"","date","text","id","link","retweets","likes","account","followers","like_ratio","retweet_ratio","interaction_ratio"
"754",2022-09-12 20:29:58,"The 22 Best- and Worst-Dressed Celebs at the 2022 #Emmys https://t.co/1noyr1ktes","1569513688297574400","<a href=""http://www.socialflow.com"" rel=""nofollow"">SocialFlow</a>",1,53,"@Cosmopolitan",1577717,3.35928433299508e-05,6.33827232640581e-07,0.150442062803405
"755",2022-09-12 19:57:18,"The #Emmys Will Give Out a Major Award This Year, and We Already Know Who Won It https://t.co/W9Hc2gFHkA","1569505469714120706","<a href=""http://www.socialflow.com"" rel=""nofollow"">SocialFlow</a>",0,4,"@Cosmopolitan",1577717,2.53530893056233e-06,0,0.150442062803405
"756",2022-09-12 19:47:38,"Sheryl Lee Ralph Just Won Her First Emmy and Her Speech Was Absolutely! Glorious!! https://t.co/awQWWgnHCb","1569503038414413831","<a href=""http://www.socialflow.com"" rel=""nofollow"">SocialFlow</a>",5,11,"@Cosmopolitan",1577717,6.97209955904639e-06,3.16913616320291e-06,0.150442062803405
"757",2022-09-12 19:40:09,"Here's Why the Kardashians Weren't at the 2022 Emmy Awards https://t.co/qZoD1D0MY5","1569501153251004419","<a href=""http://www.socialflow.com"" rel=""nofollow"">SocialFlow</a>",2,3,"@Cosmopolitan",1577717,1.90148169792174e-06,1.26765446528116e-06,0.150442062803405
"758",2022-09-12 19:32:25,"'Hacks' Star Hannah Einbinder Got Flirty with Zendaya While Presenting at the 2022 Emmys https://t.co/TIntjm8YoE","1569499208524206080","<a href=""http://www.socialflow.com"" rel=""nofollow"">SocialFlow</a>",0,1,"@Cosmopolitan",1577717,6.33827232640581e-07,0,0.150442062803405
"759",2022-09-12 19:31:58,"Jennifer Coolidge Just Won Her First Emmy and I’m Emotional https://t.co/auYjkAXPCI","1569499092887257091","<a href=""http://www.socialflow.com"" rel=""nofollow"">SocialFlow</a>",5,23,"@Cosmopolitan",1577717,1.45780263507334e-05,3.16913616320291e-06,0.150442062803405
"760",2022-09-12 19:20:47,"We Know Why the Cast of 'The Crown' Wasn't at the #Emmys https://t.co/gvZAjUUsNf","1569496278383353858","<a href=""http://www.socialflow.com"" rel=""nofollow"">SocialFlow</a>",0,0,"@Cosmopolitan",1577717,0,0,0.150442062803405
"761",2022-09-12 19:20:19,"About *That* Leonardo DiCaprio/Zendaya Age Joke Kenan Thompson Made at the #Emmys... https://t.co/AckiFGyfWo","1569496162851340288","<a href=""http://www.socialflow.com"" rel=""nofollow"">SocialFlow</a>",0,3,"@Cosmopolitan",1577717,1.90148169792174e-06,0,0.150442062803405
"762",2022-09-12 19:19:26,"Sheryl Lee Ralph Just Won Her First Emmy and Her Speech Was Absolutely! Glorious!! https://t.co/o5PVyGEXBT","1569495940846739456","<a href=""http://www.socialflow.com"" rel=""nofollow"">SocialFlow</a>",2,5,"@Cosmopolitan",1577717,3.16913616320291e-06,1.26765446528116e-06,0.150442062803405
"763",2022-09-12 19:17:06,"Selena Gomez Looks Like Someone Who's About to Win the E in EGOT on the Emmys Red Carpet https://t.co/dxepfNXYV4","1569495354457956353","<a href=""http://www.socialflow.com"" rel=""nofollow"">SocialFlow</a>",4,13,"@Cosmopolitan",1577717,8.23975402432756e-06,2.53530893056233e-06,0.150442062803405
"764",2022-09-12 19:01:41,"Here's Why Millie Bobby Brown Skipped The 2022 #Emmy Awards https://t.co/uu3QtQFMeB","1569491472734453760","<a href=""http://www.socialflow.com"" rel=""nofollow"">SocialFlow</a>",0,2,"@Cosmopolitan",1577717,1.26765446528116e-06,0,0.150442062803405
"765",2022-09-12 18:54:12,"Lizzo Hit the 2022 #Emmys Red Carpet Looking Good as Hell and Ready to Win Some Awards https://t.co/tzCE3Dr6ry","1569489589617704960","<a href=""http://www.socialflow.com"" rel=""nofollow"">SocialFlow</a>",0,9,"@Cosmopolitan",1577717,5.70444509376523e-06,0,0.150442062803405
"766",2022-09-12 18:50:21,"Why Tom Holland Isn't With Zendaya at the 2022 #Emmys https://t.co/tDxXsLZIK3","1569488622629314570","<a href=""http://www.socialflow.com"" rel=""nofollow"">SocialFlow</a>",0,3,"@Cosmopolitan",1577717,1.90148169792174e-06,0,0.150442062803405
"767",2022-09-12 18:49:22,"'Hacks' Star Hannah Einbinder Got Flirty with Zendaya While Presenting at the 2022 #Emmys https://t.co/OmTW0eBwC9","1569488374292946944","<a href=""http://www.socialflow.com"" rel=""nofollow"">SocialFlow</a>",1,2,"@Cosmopolitan",1577717,1.26765446528116e-06,6.33827232640581e-07,0.150442062803405
"768",2022-09-12 18:40:34,"Twitter Cannot Get Enough of Sofía Vergara's 2022 #Emmys Look  https://t.co/4pTLdgitB9","1569486157527785472","<a href=""http://www.socialflow.com"" rel=""nofollow"">SocialFlow</a>",0,4,"@Cosmopolitan",1577717,2.53530893056233e-06,0,0.150442062803405
"769",2022-09-12 18:30:44,"Selena Gomez Looks Like Someone Who's About to Win the E in EGOT on the Emmys Red Carpet https://t.co/yfwW8WLqVK","1569483685241536513","<a href=""http://www.socialflow.com"" rel=""nofollow"">SocialFlow</a>",11,54,"@Cosmopolitan",1577717,3.42266705625914e-05,6.97209955904639e-06,0.150442062803405
"770",2022-09-12 18:12:52,"Here’s Why Jennifer Aniston and Brad Pitt Skipped the #Emmys This Year https://t.co/9wWPryxKA4","1569479188779778049","<a href=""http://www.socialflow.com"" rel=""nofollow"">SocialFlow</a>",5,16,"@Cosmopolitan",1577717,1.01412357222493e-05,3.16913616320291e-06,0.150442062803405
"771",2022-09-12 18:09:17,"Kaley Cuoco and Tom Pelphrey Made Their Red Carpet Debut at the 2022 #Emmys https://t.co/4sxepqjXZH","1569478284030664706","<a href=""http://www.socialflow.com"" rel=""nofollow"">SocialFlow</a>",0,2,"@Cosmopolitan",1577717,1.26765446528116e-06,0,0.150442062803405
"772",2022-09-12 18:04:09,"All the Guys Are Wearing White at the 2022 #Emmy Awards https://t.co/pOjTpD5gwA","1569476992344408065","<a href=""http://www.socialflow.com"" rel=""nofollow"">SocialFlow</a>",0,4,"@Cosmopolitan",1577717,2.53530893056233e-06,0,0.150442062803405
"773",2022-09-12 17:58:16,"Ben Stiller Brought His Daughter to the Emmys and the Pics Are 🥺🥺🥺  https://t.co/5nCdFxw18s","1569475514410172417","<a href=""http://www.socialflow.com"" rel=""nofollow"">SocialFlow</a>",0,5,"@Cosmopolitan",1577717,3.16913616320291e-06,0,0.150442062803405
"774",2022-09-12 17:52:54,"Ben Stiller Brought His Daughter to the #Emmys and the Pics Are 🥺🥺🥺 https://t.co/HUdfE6EbYZ","1569474162770546689","<a href=""http://www.socialflow.com"" rel=""nofollow"">SocialFlow</a>",0,4,"@Cosmopolitan",1577717,2.53530893056233e-06,0,0.150442062803405
"775",2022-09-12 17:52:16,"Double #Emmy Nominee Sydney Sweeney Went All Out for the Red Carpet https://t.co/Q3pLxCQZ6t","1569474003848384513","<a href=""http://www.socialflow.com"" rel=""nofollow"">SocialFlow</a>",0,1,"@Cosmopolitan",1577717,6.33827232640581e-07,0,0.150442062803405
"776",2022-09-12 17:31:59,"Lizzo Hit the 2022 #Emmys Red Carpet Looking Good as Hell and Ready to Win Some Awards https://t.co/RmWxnQY02X","1569468898994446339","<a href=""http://www.socialflow.com"" rel=""nofollow"">SocialFlow</a>",0,2,"@Cosmopolitan",1577717,1.26765446528116e-06,0,0.150442062803405
"777",2022-09-12 17:28:01,"Buckle Up, It's Time to Judge the Red Carpet at the 2022 #Emmys https://t.co/i7KIlSjyfv","1569467901593149442","<a href=""http://www.socialflow.com"" rel=""nofollow"">SocialFlow</a>",0,1,"@Cosmopolitan",1577717,6.33827232640581e-07,0,0.150442062803405
"778",2022-09-12 17:26:31,"Zendaya's 2022 #Emmys Red Carpet Look Is Completely Jaw-Dropping https://t.co/Rmj2CjSKLk","1569467521908068353","<a href=""http://www.socialflow.com"" rel=""nofollow"">SocialFlow</a>",0,4,"@Cosmopolitan",1577717,2.53530893056233e-06,0,0.150442062803405
"779",2022-09-12 17:14:19,"Kanye West and Pete Davidson Could Cross Paths at the Emmys Tonight https://t.co/qnPG6bRPUX","1569464453925666816","<a href=""http://www.socialflow.com"" rel=""nofollow"">SocialFlow</a>",0,7,"@Cosmopolitan",1577717,4.43679062848407e-06,0,0.150442062803405
"780",2022-09-12 17:13:04,"Lily James Just Smashed Her First Emmy Awards Red Carpet in Versace https://t.co/yzGzF5S68z","1569464136769101826","<a href=""http://www.socialflow.com"" rel=""nofollow"">SocialFlow</a>",0,4,"@Cosmopolitan",1577717,2.53530893056233e-06,0,0.150442062803405
"781",2022-09-12 17:07:59,"Let's Discuss Consensual Non-Consent, Shall We? https://t.co/NgfrAd0Ha6","1569462859888996352","<a href=""http://www.socialflow.com"" rel=""nofollow"">SocialFlow</a>",2,7,"@Cosmopolitan",1577717,4.43679062848407e-06,1.26765446528116e-06,0.150442062803405
"782",2022-09-12 16:39:35,"Let's Discuss the Angel Number 444 https://t.co/InZueruAJ0","1569455714082619394","<a href=""http://www.socialflow.com"" rel=""nofollow"">SocialFlow</a>",1,5,"@Cosmopolitan",1577717,3.16913616320291e-06,6.33827232640581e-07,0.150442062803405
"783",2022-09-12 16:14:05,"Meghan Markle Hugs a Teen Who ""Wanted to Show Her That She's Welcome Here"" https://t.co/NQiLSwAzVV","1569449296629571585","<a href=""http://www.socialflow.com"" rel=""nofollow"">SocialFlow</a>",3,23,"@Cosmopolitan",1577717,1.45780263507334e-05,1.90148169792174e-06,0.150442062803405
"784",2022-09-12 15:59:30,"The long-awaited prequel to “Game of Thrones” is here with a star-studded ensemble cast ✨ https://t.co/02Qcwta4Mp","1569445623509680128","<a href=""https://studio.twitter.com"" rel=""nofollow"">Twitter Media Studio</a>",1,4,"@Cosmopolitan",1577717,2.53530893056233e-06,6.33827232640581e-07,0.150442062803405
"785",2022-09-12 15:58:53,"St. Lucia's Sugar Beach is a Seriously Stunning Vacay Destination https://t.co/S3BxPx9nYE","1569445467926269953","<a href=""http://www.socialflow.com"" rel=""nofollow"">SocialFlow</a>",1,10,"@Cosmopolitan",1577717,6.33827232640581e-06,6.33827232640581e-07,0.150442062803405
"786",2022-09-12 15:30:18,"Nothing says Game Day like a cocktail in one hand and a @kingshawaiian Early Game Slider in the other. Sorry, I don't make the rules. #ad https://t.co/noQ1A0TMJ3 https://t.co/i8gEhj0BM4","1569438275089346560","<a href=""http://www.socialflow.com"" rel=""nofollow"">SocialFlow</a>",1,3,"@Cosmopolitan",1577717,1.90148169792174e-06,6.33827232640581e-07,0.150442062803405
"787",2022-09-12 15:28:51,"Buckle Up, It's Time to Judge the Red Carpet at the 2022 #Emmys https://t.co/qcp96wIfYh","1569437909455106050","<a href=""http://www.socialflow.com"" rel=""nofollow"">SocialFlow</a>",0,6,"@Cosmopolitan",1577717,3.80296339584349e-06,0,0.150442062803405
"788",2022-09-12 13:58:00,"Wanna be on top? These 7 supermodels are 💋 https://t.co/JPqn0G2jVA","1569415047272714240","<a href=""https://studio.twitter.com"" rel=""nofollow"">Twitter Media Studio</a>",0,0,"@Cosmopolitan",1577717,0,0,0.150442062803405
"789",2022-09-12 13:57:00,"The star of “Don't Worry Darling” is having a major moment right now. After appearing in hit films like Marvel’s “Black Widow"" and Greta Gerwig's ""Little Women,"" Florence Pugh's career and life have some unmissable highlights. https://t.co/g95nvFyifG","1569414795870277632","<a href=""https://studio.twitter.com"" rel=""nofollow"">Twitter Media Studio</a>",0,2,"@Cosmopolitan",1577717,1.26765446528116e-06,0,0.150442062803405
"790",2022-09-12 13:30:00,"Do you know the ""big four"" fashion week cities? Press play to test your knowledge! https://t.co/KSAn97w27K","1569408000758013954","<a href=""https://studio.twitter.com"" rel=""nofollow"">Twitter Media Studio</a>",5,43,"@Cosmopolitan",1577717,2.7254571003545e-05,3.16913616320291e-06,0.150442062803405
"791",2022-09-12 13:24:06,"These Flannel Pajama Sets Are a Must for Extra-Cozy Nights This Winter https://t.co/sR9KjdUzkm","1569406518067449856","<a href=""http://www.socialflow.com"" rel=""nofollow"">SocialFlow</a>",0,1,"@Cosmopolitan",1577717,6.33827232640581e-07,0,0.150442062803405
"792",2022-09-12 12:43:52,"Get to Know the Cast of ABC's ‘Abbott Elementary’ https://t.co/mK74aNcLo6","1569396390706438144","<a href=""http://www.socialflow.com"" rel=""nofollow"">SocialFlow</a>",0,1,"@Cosmopolitan",1577717,6.33827232640581e-07,0,0.150442062803405
"793",2022-09-12 12:22:12,"Harry Styles on Building ""Trust and Safety” With ‘My Policeman’ Costars Emma Corrin and David Dawson https://t.co/7mWNINm4aW","1569390937842892802","<a href=""http://www.socialflow.com"" rel=""nofollow"">SocialFlow</a>",1,7,"@Cosmopolitan",1577717,4.43679062848407e-06,6.33827232640581e-07,0.150442062803405
"794",2022-09-12 12:00:30,"Anitta reveals her style icon, how she takes risks in fashion &amp; MORE! https://t.co/YinEHyOQMv","1569385478524207105","<a href=""https://studio.twitter.com"" rel=""nofollow"">Twitter Media Studio</a>",2,19,"@Cosmopolitan",1577717,1.2042717420171e-05,1.26765446528116e-06,0.150442062803405
"795",2022-09-12 11:56:51,"This Is the Royal Family's Dress Code for the Queen’s Funeral https://t.co/YUIMZlMFRL","1569384557845020675","<a href=""http://www.socialflow.com"" rel=""nofollow"">SocialFlow</a>",0,5,"@Cosmopolitan",1577717,3.16913616320291e-06,0,0.150442062803405
"796",2022-09-12 11:16:59,"These Horrifying Halloween Movies on Netflix Will Haunt You All October Long https://t.co/ap7PCYnxkB","1569374526563041281","<a href=""http://www.socialflow.com"" rel=""nofollow"">SocialFlow</a>",0,6,"@Cosmopolitan",1577717,3.80296339584349e-06,0,0.150442062803405
"797",2022-09-12 10:58:30,"Get your blood flowing utilizing an everyday kettlebell. https://t.co/6XIbBYmnRh","1569369874475909120","<a href=""https://studio.twitter.com"" rel=""nofollow"">Twitter Media Studio</a>",0,0,"@Cosmopolitan",1577717,0,0,0.150442062803405
"798",2022-09-12 10:53:54,"Taylor Swift Just Addressed What the Red Scarf in the ‘All Too Well’ Short Film Really Means https://t.co/79ue2iKlwv","1569368719498813441","<a href=""http://www.socialflow.com"" rel=""nofollow"">SocialFlow</a>",0,3,"@Cosmopolitan",1577717,1.90148169792174e-06,0,0.150442062803405
"799",2022-09-12 10:38:42,"'Abbott Elementary' Season 2 Is Indeed Premiering Soon, So It's Time to Learn More About It https://t.co/P1BOiNcqpz","1569364891135365122","<a href=""http://www.socialflow.com"" rel=""nofollow"">SocialFlow</a>",0,5,"@Cosmopolitan",1577717,3.16913616320291e-06,0,0.150442062803405
"800",2022-09-12 10:08:11,"Hailey Bieber's Blue Bikini is On Sale for Less Than $15 https://t.co/f7I2J0KVdq","1569357211163320320","<a href=""http://www.socialflow.com"" rel=""nofollow"">SocialFlow</a>",0,0,"@Cosmopolitan",1577717,0,0,0.150442062803405
"801",2022-09-12 10:08:10,"Kourtney Kardashian Poses Naked in Heels to Announce New Vitamin Brand Lemme https://t.co/miMqlGsFL0","1569357210366386177","<a href=""http://www.socialflow.com"" rel=""nofollow"">SocialFlow</a>",0,2,"@Cosmopolitan",1577717,1.26765446528116e-06,0,0.150442062803405
"802",2022-09-12 10:08:10,"Kendall Jenner Nails the Nearly Nude Trend in Patterned See-Through Pants https://t.co/01OHuTWO7t","1569357210303569929","<a href=""http://www.socialflow.com"" rel=""nofollow"">SocialFlow</a>",1,0,"@Cosmopolitan",1577717,0,6.33827232640581e-07,0.150442062803405
"803",2022-09-12 10:08:10,"Megan Fox and Machine Gun Kelly Coordinate in Sparkling Looks for a Disco Date Night https://t.co/oCEViCOoaa","1569357209498165248","<a href=""http://www.socialflow.com"" rel=""nofollow"">SocialFlow</a>",0,4,"@Cosmopolitan",1577717,2.53530893056233e-06,0,0.150442062803405
"804",2022-09-12 10:08:10,"Harry Potter's Draco and Lucius Malfoy Just Had a Sweet Reunion https://t.co/BaIfBI21xA","1569357207598235651","<a href=""http://www.socialflow.com"" rel=""nofollow"">SocialFlow</a>",0,2,"@Cosmopolitan",1577717,1.26765446528116e-06,0,0.150442062803405
"805",2022-09-12 10:05:09,"Hailey Bieber's Take on Barbiecore Includes a Bodycon Mini Dress and an Oversized Blazer https://t.co/21S3fOt4Ty","1569356449649725446","<a href=""http://www.socialflow.com"" rel=""nofollow"">SocialFlow</a>",0,2,"@Cosmopolitan",1577717,1.26765446528116e-06,0,0.150442062803405
"806",2022-09-12 09:28:48,"Fans Rally Around Mayim Bialik After Her Pap Smear Post on Instagram https://t.co/kuEawmQ51Z","1569347302359273474","<a href=""http://www.socialflow.com"" rel=""nofollow"">SocialFlow</a>",1,9,"@Cosmopolitan",1577717,5.70444509376523e-06,6.33827232640581e-07,0.150442062803405
"807",2022-09-12 09:07:53,"Fall’s Biggest Makeup Trends Are Perfect for Your Next Vacation https://t.co/8yWYsrk15d","1569342039334035457","<a href=""http://www.socialflow.com"" rel=""nofollow"">SocialFlow</a>",0,7,"@Cosmopolitan",1577717,4.43679062848407e-06,0,0.150442062803405
"808",2022-09-12 09:00:01,"She! Can't! Miss! https://t.co/XNHKCnyanM","1569340060322914304","<a href=""https://studio.twitter.com"" rel=""nofollow"">Twitter Media Studio</a>",1,7,"@Cosmopolitan",1577717,4.43679062848407e-06,6.33827232640581e-07,0.150442062803405
"809",2022-09-12 08:21:22,"The Queen's Jewelry, Crowns, and Tiaras Will Likely Go Directly to One Person for Tax Reasons https://t.co/sN5J51cYZa","1569330333618692099","<a href=""http://www.socialflow.com"" rel=""nofollow"">SocialFlow</a>",0,2,"@Cosmopolitan",1577717,1.26765446528116e-06,0,0.150442062803405
"810",2022-09-12 08:20:50,"Prince Harry Is Not Allowed to Wear Military Attire at Queen's Vigil, But Exception Made for Prince Andrew https://t.co/rIbklEMSes","1569330198541209600","<a href=""http://www.socialflow.com"" rel=""nofollow"">SocialFlow</a>",3,9,"@Cosmopolitan",1577717,5.70444509376523e-06,1.90148169792174e-06,0.150442062803405
"811",2022-09-12 07:58:42,"Inside the Sussexes and Cambridges' Walk: William's Last Minute Invite and ""Carefully Planned Choreography"" https://t.co/AbeEfJGNtS","1569324627989495808","<a href=""http://www.socialflow.com"" rel=""nofollow"">SocialFlow</a>",0,5,"@Cosmopolitan",1577717,3.16913616320291e-06,0,0.150442062803405
"812",2022-09-12 07:37:30,"Nicki Minaj's Entire Boob Fell Out at a Concert and She Handled It Like a Boss https://t.co/jkcI4oABRn","1569319291543068673","<a href=""http://www.socialflow.com"" rel=""nofollow"">SocialFlow</a>",0,6,"@Cosmopolitan",1577717,3.80296339584349e-06,0,0.150442062803405
"813",2022-09-12 07:00:02,"This video in emojis: 😂😂😂😂😂😂 https://t.co/M0eMwFrF7j","1569309865046048768","<a href=""https://studio.twitter.com"" rel=""nofollow"">Twitter Media Studio</a>",2,11,"@Cosmopolitan",1577717,6.97209955904639e-06,1.26765446528116e-06,0.150442062803405
"814",2022-09-12 06:42:14,"Prince William and Prince Harry's Cousin Peter Phillips Could Play ""Peacemaker"" https://t.co/McS8u0f3XG","1569305382715113472","<a href=""http://www.socialflow.com"" rel=""nofollow"">SocialFlow</a>",2,11,"@Cosmopolitan",1577717,6.97209955904639e-06,1.26765446528116e-06,0.150442062803405
"815",2022-09-12 06:11:30,"Kate Middleton and Prince William Will Delay Move to Windsor Castle to Avoid More ""Upheaval"" for Their Kids https://t.co/I8s3mDjJsy","1569297650536652800","<a href=""http://www.socialflow.com"" rel=""nofollow"">SocialFlow</a>",0,14,"@Cosmopolitan",1577717,8.87358125696814e-06,0,0.150442062803405
"816",2022-09-12 05:50:30,"Prince Harry Releases Touching Statement Honoring His ""Granny"" Queen Elizabeth https://t.co/vRtgCfznKH","1569292363306078209","<a href=""http://www.socialflow.com"" rel=""nofollow"">SocialFlow</a>",4,22,"@Cosmopolitan",1577717,1.39441991180928e-05,2.53530893056233e-06,0.150442062803405
"817",2022-09-12 05:00:03,"Iconic behavior. https://t.co/aB7eKXubxF","1569279668498432000","<a href=""https://studio.twitter.com"" rel=""nofollow"">Twitter Media Studio</a>",1,4,"@Cosmopolitan",1577717,2.53530893056233e-06,6.33827232640581e-07,0.150442062803405
"818",2022-09-12 04:19:22,"Hello, Your Weekly Tarot Card Reading Is Here https://t.co/emO5ei2JFE","1569269430164590593","<a href=""http://www.socialflow.com"" rel=""nofollow"">SocialFlow</a>",0,0,"@Cosmopolitan",1577717,0,0,0.150442062803405
"819",2022-09-11 23:44:55,"It’s Here: The Official List of the 16 Celebrities on ‘Dancing With the Stars’ Season 31 https://t.co/tca5EyFHEb","1569200364582215681","<a href=""http://www.socialflow.com"" rel=""nofollow"">SocialFlow</a>",0,1,"@Cosmopolitan",1577717,6.33827232640581e-07,0,0.150442062803405
"820",2022-09-11 17:41:05,"Nate Addressed *Those* Viral TikToks He Posted About Gabby https://t.co/L8sc7ss81f","1569108801600606208","<a href=""http://www.socialflow.com"" rel=""nofollow"">SocialFlow</a>",0,2,"@Cosmopolitan",1577717,1.26765446528116e-06,0,0.150442062803405
"821",2022-09-11 17:09:54,"Harry and Meghan's Kids *Might* Fly to the U.K. to Attend the Queen's Funeral https://t.co/PHXMhoFyzq","1569100951667056643","<a href=""http://www.socialflow.com"" rel=""nofollow"">SocialFlow</a>",0,8,"@Cosmopolitan",1577717,5.07061786112465e-06,0,0.150442062803405
"822",2022-09-11 15:24:00,"The long-awaited prequel to “Game of Thrones” is here with a star-studded ensemble cast ✨ https://t.co/FuDyvu7Rhb","1569074301961125891","<a href=""https://studio.twitter.com"" rel=""nofollow"">Twitter Media Studio</a>",1,6,"@Cosmopolitan",1577717,3.80296339584349e-06,6.33827232640581e-07,0.150442062803405
"823",2022-09-11 15:07:25,"Charles Reportedly Made It ""Very, Very Clear Meghan Would Not Be Welcome"" at Balmoral Thursday https://t.co/rrVGI1cmKx","1569070128347619334","<a href=""http://www.socialflow.com"" rel=""nofollow"">SocialFlow</a>",1,11,"@Cosmopolitan",1577717,6.97209955904639e-06,6.33827232640581e-07,0.150442062803405
"824",2022-09-11 13:48:00,"Every year, the Emmys bring glamor and excitement as it celebrates primetime television. Millions tune in to see which stars and shows will take a trophy home, but the awards ceremony itself is also very interesting. Learn more about it! https://t.co/vhgWv3513J","1569050142698717184","<a href=""https://studio.twitter.com"" rel=""nofollow"">Twitter Media Studio</a>",1,1,"@Cosmopolitan",1577717,6.33827232640581e-07,6.33827232640581e-07,0.150442062803405
"825",2022-09-11 13:10:54,"The Palace Clarifies Why Meghan and Harry's Kids Archie and Lilibet Haven't Had Royal Titles Changed Yet https://t.co/eQVarMuSZ4","1569040807440666629","<a href=""http://www.socialflow.com"" rel=""nofollow"">SocialFlow</a>",1,7,"@Cosmopolitan",1577717,4.43679062848407e-06,6.33827232640581e-07,0.150442062803405
"826",2022-09-11 12:49:10,"Kate Middleton Shared How Prince Louis Comforted Her After the Queen's Death https://t.co/8SMKLPjltf","1569035339448164355","<a href=""http://www.socialflow.com"" rel=""nofollow"">SocialFlow</a>",0,6,"@Cosmopolitan",1577717,3.80296339584349e-06,0,0.150442062803405
"827",2022-09-11 12:24:00,"Wanna be on top? These 7 supermodels are 💋 https://t.co/hKHH2wDQdn","1569029003503083521","<a href=""https://studio.twitter.com"" rel=""nofollow"">Twitter Media Studio</a>",1,3,"@Cosmopolitan",1577717,1.90148169792174e-06,6.33827232640581e-07,0.150442062803405
"828",2022-09-11 10:24:30,"Get your blood flowing utilizing an everyday kettlebell. https://t.co/OhCVXLpGtT","1568998930414817280","<a href=""https://studio.twitter.com"" rel=""nofollow"">Twitter Media Studio</a>",0,7,"@Cosmopolitan",1577717,4.43679062848407e-06,0,0.150442062803405
"829",2022-09-11 10:01:22,"Prince George, Princess Charlotte, and Prince Louis Receive New Titles https://t.co/Gdmub2BDVk","1568993110125936640","<a href=""http://www.socialflow.com"" rel=""nofollow"">SocialFlow</a>",2,13,"@Cosmopolitan",1577717,8.23975402432756e-06,1.26765446528116e-06,0.150442062803405
"830",2022-09-11 08:23:00,"She! Can't! Miss! https://t.co/4heEkaR6jQ","1568968353942839296","<a href=""https://studio.twitter.com"" rel=""nofollow"">Twitter Media Studio</a>",3,23,"@Cosmopolitan",1577717,1.45780263507334e-05,1.90148169792174e-06,0.150442062803405
"831",2022-09-11 08:16:11,"The Dragon Egg in 'House of the Dragon' Is a Literal Easter Egg—and Part of a Bigger 'Game of Thrones' Theory https://t.co/3RjHF5lgtb","1568966640007512065","<a href=""http://www.socialflow.com"" rel=""nofollow"">SocialFlow</a>",0,1,"@Cosmopolitan",1577717,6.33827232640581e-07,0,0.150442062803405
"832",2022-09-11 06:23:30,"This video in emojis: 😂😂😂😂😂😂 https://t.co/325KcScJuq","1568938280648933377","<a href=""https://studio.twitter.com"" rel=""nofollow"">Twitter Media Studio</a>",1,19,"@Cosmopolitan",1577717,1.2042717420171e-05,6.33827232640581e-07,0.150442062803405
"833",2022-09-11 04:22:30,"Iconic behavior. https://t.co/J1WxfyKOEH","1568907829943074816","<a href=""https://studio.twitter.com"" rel=""nofollow"">Twitter Media Studio</a>",2,15,"@Cosmopolitan",1577717,9.50740848960872e-06,1.26765446528116e-06,0.150442062803405
"834",2022-09-11 04:11:28,"Hi Hello, Your Weekly Horoscope Is Here https://t.co/S9V7FfdAse","1568905054039441409","<a href=""http://www.socialflow.com"" rel=""nofollow"">SocialFlow</a>",0,2,"@Cosmopolitan",1577717,1.26765446528116e-06,0,0.150442062803405
"835",2022-09-10 14:13:11,"Prince Harry Is ""Full of Sorrow and Regret"" Over Not Seeing the Queen Before Her Death https://t.co/6BiaWHEbLj","1568694092678176768","<a href=""http://www.socialflow.com"" rel=""nofollow"">SocialFlow</a>",6,8,"@Cosmopolitan",1577717,5.07061786112465e-06,3.80296339584349e-06,0.150442062803405
"836",2022-09-10 13:57:00,"The star of “Don't Worry Darling” is having a major moment right now. After appearing in hit films like Marvel’s “Black Widow"" and Greta Gerwig's ""Little Women,"" Florence Pugh's career and life have some unmissable highlights. https://t.co/87fn70wJe0","1568690019803533312","<a href=""https://studio.twitter.com"" rel=""nofollow"">Twitter Media Studio</a>",1,3,"@Cosmopolitan",1577717,1.90148169792174e-06,6.33827232640581e-07,0.150442062803405
"837",2022-09-10 12:22:00,"Here’s how Taylor became one of the world’s most successful artists. https://t.co/wMlQ2zTnBx","1568666112098635776","<a href=""https://studio.twitter.com"" rel=""nofollow"">Twitter Media Studio</a>",6,8,"@Cosmopolitan",1577717,5.07061786112465e-06,3.80296339584349e-06,0.150442062803405
"838",2022-09-10 10:24:43,"Kate Middleton and Prince William Make First Comments on the Queen's Death https://t.co/9sLwzNbpUF","1568636596043513856","<a href=""http://www.socialflow.com"" rel=""nofollow"">SocialFlow</a>",0,6,"@Cosmopolitan",1577717,3.80296339584349e-06,0,0.150442062803405
